[
  {
    "src": "schemas/board.schema.json",
    "dst": "schemas/board.schema.json",
    "mode": "rebase",
    "notes": "page_type enum and offer_model need BSUK values; hand-edited after the first port"
  },
  {
    "src": "schemas/component-ledger.schema.json",
    "dst": "schemas/component-ledger.schema.json",
    "mode": "rebase",
    "notes": "structure only; title re-based to BSUK; ledger stays empty until project 3"
  },
  {
    "src": "schemas/ontology.schema.json",
    "dst": "schemas/ontology.schema.json",
    "mode": "rebase",
    "notes": "structure only; title re-based to BSUK"
  },
  {
    "src": ".claude/commands/opsx/propose.md",
    "dst": ".claude/commands/opsx/propose.md",
    "mode": "copy",
    "notes": "openspec command, site-agnostic"
  },
  {
    "src": ".claude/commands/opsx/explore.md",
    "dst": ".claude/commands/opsx/explore.md",
    "mode": "copy",
    "notes": "openspec command, site-agnostic"
  },
  {
    "src": ".claude/commands/opsx/apply.md",
    "dst": ".claude/commands/opsx/apply.md",
    "mode": "copy",
    "notes": "openspec command, site-agnostic"
  },
  {
    "src": ".claude/commands/opsx/archive.md",
    "dst": ".claude/commands/opsx/archive.md",
    "mode": "copy",
    "notes": "openspec command, site-agnostic"
  },
  {
    "src": ".claude/skills/anti-ai-writing/SKILL.md",
    "dst": ".claude/skills/anti-ai-writing/SKILL.md",
    "mode": "rebase",
    "notes": "generic skill structure; CAG worked examples re-based to BSUK puppy vocabulary"
  },
  {
    "src": ".claude/skills/keyword-cluster/SKILL.md",
    "dst": ".claude/skills/keyword-cluster/SKILL.md",
    "mode": "rebase",
    "notes": "generic skill structure; CAG worked examples re-based to BSUK puppy vocabulary"
  },
  {
    "src": ".claude/skills/internal-link-agent/SKILL.md",
    "dst": ".claude/skills/internal-link-agent/SKILL.md",
    "mode": "rebase",
    "notes": "generic skill structure; CAG worked examples re-based to BSUK puppy vocabulary"
  },
  {
    "src": ".claude/skills/sitemap-agent/SKILL.md",
    "dst": ".claude/skills/sitemap-agent/SKILL.md",
    "mode": "rebase",
    "notes": "generic skill structure; CAG worked examples re-based to BSUK puppy vocabulary"
  },
  {
    "src": ".claude/skills/section-auditor/SKILL.md",
    "dst": ".claude/skills/section-auditor/SKILL.md",
    "mode": "rebase",
    "notes": "generic skill structure; CAG worked examples re-based to BSUK puppy vocabulary"
  },
  {
    "src": ".claude/skills/manual-auditor-check/SKILL.md",
    "dst": ".claude/skills/manual-auditor-check/SKILL.md",
    "mode": "rebase",
    "notes": "generic skill structure; CAG worked examples re-based to BSUK puppy vocabulary"
  },
  {
    "src": ".claude/skills/research-recency/SKILL.md",
    "dst": ".claude/skills/research-recency/SKILL.md",
    "mode": "rebase",
    "notes": "generic skill structure; CAG worked examples re-based to BSUK puppy vocabulary"
  },
  {
    "src": ".claude/skills/image-metadata/SKILL.md",
    "dst": ".claude/skills/image-metadata/SKILL.md",
    "mode": "rebase",
    "notes": "generic skill structure; CAG worked examples re-based to BSUK puppy vocabulary"
  },
  {
    "src": ".claude/skills/framework-aida/SKILL.md",
    "dst": ".claude/skills/framework-aida/SKILL.md",
    "mode": "rebase",
    "notes": "generic skill structure; CAG worked examples re-based to BSUK puppy vocabulary"
  },
  {
    "src": ".claude/skills/framework-aio-geo/SKILL.md",
    "dst": ".claude/skills/framework-aio-geo/SKILL.md",
    "mode": "rebase",
    "notes": "generic skill structure; CAG worked examples re-based to BSUK puppy vocabulary"
  },
  {
    "src": ".claude/skills/framework-bab/SKILL.md",
    "dst": ".claude/skills/framework-bab/SKILL.md",
    "mode": "rebase",
    "notes": "generic skill structure; CAG worked examples re-based to BSUK puppy vocabulary"
  },
  {
    "src": ".claude/skills/framework-ebp/SKILL.md",
    "dst": ".claude/skills/framework-ebp/SKILL.md",
    "mode": "rebase",
    "notes": "generic skill structure; CAG worked examples re-based to BSUK puppy vocabulary"
  },
  {
    "src": ".claude/skills/framework-eeat/SKILL.md",
    "dst": ".claude/skills/framework-eeat/SKILL.md",
    "mode": "rebase",
    "notes": "generic skill structure; CAG worked examples re-based to BSUK puppy vocabulary"
  },
  {
    "src": ".claude/skills/framework-eebp/SKILL.md",
    "dst": ".claude/skills/framework-eebp/SKILL.md",
    "mode": "rebase",
    "notes": "generic skill structure; CAG worked examples re-based to BSUK puppy vocabulary"
  },
  {
    "src": ".claude/skills/framework-fab/SKILL.md",
    "dst": ".claude/skills/framework-fab/SKILL.md",
    "mode": "rebase",
    "notes": "generic skill structure; CAG worked examples re-based to BSUK puppy vocabulary"
  },
  {
    "src": ".claude/skills/framework-heading-hierarchy/SKILL.md",
    "dst": ".claude/skills/framework-heading-hierarchy/SKILL.md",
    "mode": "rebase",
    "notes": "generic skill structure; CAG worked examples re-based to BSUK puppy vocabulary"
  },
  {
    "src": ".claude/skills/framework-library/SKILL.md",
    "dst": ".claude/skills/framework-library/SKILL.md",
    "mode": "rebase",
    "notes": "generic skill structure; CAG worked examples re-based to BSUK puppy vocabulary"
  },
  {
    "src": ".claude/skills/framework-pas/SKILL.md",
    "dst": ".claude/skills/framework-pas/SKILL.md",
    "mode": "rebase",
    "notes": "generic skill structure; CAG worked examples re-based to BSUK puppy vocabulary"
  },
  {
    "src": ".claude/skills/framework-pdb/SKILL.md",
    "dst": ".claude/skills/framework-pdb/SKILL.md",
    "mode": "rebase",
    "notes": "generic skill structure; CAG worked examples re-based to BSUK puppy vocabulary"
  },
  {
    "src": ".claude/skills/framework-qab/SKILL.md",
    "dst": ".claude/skills/framework-qab/SKILL.md",
    "mode": "rebase",
    "notes": "generic skill structure; CAG worked examples re-based to BSUK puppy vocabulary"
  },
  {
    "src": ".claude/skills/image-prompt-generator/SKILL.md",
    "dst": ".claude/skills/image-prompt-generator/SKILL.md",
    "mode": "rebase",
    "notes": "generic skill structure; CAG worked examples re-based to BSUK puppy vocabulary"
  },
  {
    "src": ".claude/skills/caption-writer/SKILL.md",
    "dst": ".claude/skills/caption-writer/SKILL.md",
    "mode": "rebase",
    "notes": "generic skill structure; CAG worked examples re-based to BSUK puppy vocabulary"
  },
  {
    "src": ".claude/skills/grill-me/SKILL.md",
    "dst": ".claude/skills/grill-me/SKILL.md",
    "mode": "rebase",
    "notes": "generic skill structure; CAG worked examples re-based to BSUK puppy vocabulary"
  },
  {
    "src": ".claude/skills/session-closer/SKILL.md",
    "dst": ".claude/skills/session-closer/SKILL.md",
    "mode": "rebase",
    "notes": "generic skill structure; CAG worked examples re-based to BSUK puppy vocabulary"
  },
  {
    "src": ".claude/skills/openspec-propose/SKILL.md",
    "dst": ".claude/skills/openspec-propose/SKILL.md",
    "mode": "copy",
    "notes": "generic"
  },
  {
    "src": ".claude/skills/openspec-explore/SKILL.md",
    "dst": ".claude/skills/openspec-explore/SKILL.md",
    "mode": "copy",
    "notes": "generic"
  },
  {
    "src": ".claude/skills/openspec-apply-change/SKILL.md",
    "dst": ".claude/skills/openspec-apply-change/SKILL.md",
    "mode": "copy",
    "notes": "generic"
  },
  {
    "src": ".claude/skills/openspec-archive-change/SKILL.md",
    "dst": ".claude/skills/openspec-archive-change/SKILL.md",
    "mode": "copy",
    "notes": "generic"
  },
  {
    "src": ".claude/skills/cag-component-refresh/SKILL.md",
    "dst": ".claude/skills/bsuk-component-refresh/SKILL.md",
    "mode": "rebase",
    "notes": "re-based onto the board system in Task 18c: boardStyles.ts + /board-preview/, not a design canvas"
  },
  {
    "src": ".claude/skills/cag-component-variations/SKILL.md",
    "dst": ".claude/skills/bsuk-component-variations/SKILL.md",
    "mode": "rebase",
    "notes": "re-based onto the board system in Task 18c: boardStyles.ts + /board-preview/, not a design canvas"
  },
  {
    "src": ".claude/skills/cag-multi-agent-design/SKILL.md",
    "dst": ".claude/skills/bsuk-multi-agent-design/SKILL.md",
    "mode": "deferred",
    "notes": "project 3 brings the design system"
  },
  {
    "src": ".claude/skills/cag-design-rebuild/SKILL.md",
    "dst": ".claude/skills/bsuk-design-rebuild/SKILL.md",
    "mode": "deferred",
    "notes": "project 3 brings the design system"
  },
  {
    "src": ".claude/skills/cag-direction-d-theme/SKILL.md",
    "dst": ".claude/skills/bsuk-direction-d-theme/SKILL.md",
    "mode": "deferred",
    "notes": "project 3 brings the design system"
  },
  {
    "src": ".claude/skills/cag-visual-intelligence/SKILL.md",
    "dst": ".claude/skills/bsuk-visual-intelligence/SKILL.md",
    "mode": "deferred",
    "notes": "project 3 brings the design system"
  },
  {
    "src": ".claude/skills/cag-image-generation/SKILL.md",
    "dst": ".claude/skills/bsuk-image-generation/SKILL.md",
    "mode": "deferred",
    "notes": "project 3 brings the design system"
  },
  {
    "src": ".claude/skills/cag-photo-ingest/SKILL.md",
    "dst": ".claude/skills/bsuk-photo-ingest/SKILL.md",
    "mode": "deferred",
    "notes": "project 3 brings the design system"
  },
  {
    "src": ".claude/skills/cag-infographic/SKILL.md",
    "dst": ".claude/skills/bsuk-infographic/SKILL.md",
    "mode": "deferred",
    "notes": "project 3 brings the design system"
  },
  {
    "src": ".claude/skills/cag-logo-generator/SKILL.md",
    "dst": ".claude/skills/bsuk-logo-generator/SKILL.md",
    "mode": "deferred",
    "notes": "project 3 brings the design system"
  },
  {
    "src": ".claude/agents/cag-ab-test-agent.md",
    "dst": ".claude/agents/bsuk-ab-test-agent.md",
    "mode": "deferred",
    "notes": "spec §10 out of scope; project 6 at the earliest"
  },
  {
    "src": ".claude/agents/cag-backlink-outreach-agent.md",